{
  "type": "Feature",
  "id": "3f2b9c1e-7a4d-4e21-9b0f-5c6d7e8f9a01",
  "geometry": { "type": "Point", "coordinates": [103.0855, 1.8585] },
  "properties": {
    "campus_id": "parit-raja",
    "kind": "entrance",
    "category": "entrance",
    "name_en": "Main entrance",
    "name_ms": "Pintu utama",
    "aliases": [],
    "parent_id": "0a1b2c3d-4e5f-4a6b-8c7d-9e0f1a2b3c4d",
    "bearing_deg": 172.5,
    "accessible": true,
    "capture": {
      "method": "averaged",
      "n": 30,
      "std_m": 1.8,
      "mean_acc_m": 4.2,
      "best_acc_m": 3.1,
      "sats_used": 22,
      "sats_visible": 31,
      "stop_reason": "count",
      "started_at": "2026-10-20T08:15:02+08:00",
      "ended_at": "2026-10-20T08:15:33+08:00",
      "recaptures": 0
    },
    "photos": [{ "file": "photos/3f2b9c1e-1.jpg", "taken_at": "2026-10-20T08:15:40+08:00" }],
    "notes": "Sample feature for schema tests; coordinates are illustrative.",
    "name_suggestion": null,
    "source": "survey",
    "verified": true,
    "last_verified": "2026-10-20",
    "created_at": "2026-10-20T08:15:33+08:00",
    "updated_at": "2026-10-20T08:15:33+08:00"
  }
}
